{
    "salutation": "MS",
    "first_name": "Andrea",
    "last_name": "Auer",
    "email_address": "Andrea.Auer@at.soliver.com",
    "type": "css",
    "last_editor": "Sandra.Tietel@de.soliver.com",
    "languages": [
        "de"
    ],
    "status": "active",
    "companies": [
        "110"
    ]
}